{
  "$schema": "https://json-schema.org/draft/2020-12/schema",
  "$id": "https://example.invalid/schemas/food-resilience-audit.schema.json",
  "title": "Food Resilience Audit",
  "type": "object",
  "additionalProperties": false,
  "required": [
    "schema_version",
    "food_audit_id",
    "capability_id",
    "service_scope",
    "demand",
    "inventory",
    "nutrition",
    "storage",
    "cooking",
    "replenishment",
    "dependencies",
    "single_points_of_failure",
    "maintenance_status",
    "independent_review_completed",
    "evidence_refs",
    "updated_at",
    "data_sensitivity"
  ],
  "properties": {
    "schema_version": {
      "const": "0.1.0"
    },
    "food_audit_id": {
      "type": "string",
      "pattern": "^fra-[A-Za-z0-9._-]+$"
    },
    "capability_id": {
      "type": "string",
      "pattern": "^cap-[A-Za-z0-9._-]+$"
    },
    "service_scope": {
      "enum": [
        "unknown",
        "emergency_buffer",
        "sustained_resilience"
      ]
    },
    "demand": {
      "type": "object",
      "additionalProperties": false,
      "required": [
        "people_count",
        "daily_calorie_demand_kcal",
        "special_requirements_mapped"
      ],
      "properties": {
        "people_count": {
          "type": [
            "integer",
            "null"
          ],
          "minimum": 1
        },
        "daily_calorie_demand_kcal": {
          "type": [
            "number",
            "null"
          ],
          "exclusiveMinimum": 0
        },
        "special_requirements_mapped": {
          "type": [
            "boolean",
            "null"
          ]
        }
      }
    },
    "inventory": {
      "type": "object",
      "additionalProperties": false,
      "required": [
        "inventory_count_status",
        "usable_calories_kcal",
        "shelf_stable_calories_kcal",
        "rotation_status"
      ],
      "properties": {
        "inventory_count_status": {
          "enum": [
            "unknown",
            "estimated",
            "measured"
          ]
        },
        "usable_calories_kcal": {
          "type": [
            "number",
            "null"
          ],
          "minimum": 0
        },
        "shelf_stable_calories_kcal": {
          "type": [
            "number",
            "null"
          ],
          "minimum": 0
        },
        "rotation_status": {
          "enum": [
            "unknown",
            "not_established",
            "routine",
            "tested"
          ]
        }
      }
    },
    "nutrition": {
      "type": "object",
      "additionalProperties": false,
      "required": [
        "plan_status",
        "protein_sources_mapped",
        "fat_sources_mapped",
        "micronutrient_strategy_mapped",
        "dietary_constraints_mapped"
      ],
      "properties": {
        "plan_status": {
          "enum": [
            "unknown",
            "incomplete",
            "reviewed"
          ]
        },
        "protein_sources_mapped": {
          "type": [
            "boolean",
            "null"
          ]
        },
        "fat_sources_mapped": {
          "type": [
            "boolean",
            "null"
          ]
        },
        "micronutrient_strategy_mapped": {
          "type": [
            "boolean",
            "null"
          ]
        },
        "dietary_constraints_mapped": {
          "type": [
            "boolean",
            "null"
          ]
        }
      }
    },
    "storage": {
      "type": "object",
      "additionalProperties": false,
      "required": [
        "dry_storage_status",
        "pest_moisture_control_status",
        "cold_chain_dependency",
        "cold_chain_outage_test"
      ],
      "properties": {
        "dry_storage_status": {
          "enum": [
            "unknown",
            "absent",
            "present_unverified",
            "inspected_pass",
            "inspected_fail",
            "not_required"
          ]
        },
        "pest_moisture_control_status": {
          "enum": [
            "unknown",
            "unverified",
            "adequate",
            "failed",
            "not_required"
          ]
        },
        "cold_chain_dependency": {
          "enum": [
            "unknown",
            "none",
            "partial",
            "critical"
          ]
        },
        "cold_chain_outage_test": {
          "enum": [
            "not_run",
            "pass",
            "partial",
            "fail",
            "not_required"
          ]
        }
      }
    },
    "cooking": {
      "type": "object",
      "additionalProperties": false,
      "required": [
        "primary_path",
        "backup_path_status",
        "outage_cooking_test"
      ],
      "properties": {
        "primary_path": {
          "enum": [
            "unknown",
            "electric",
            "gas",
            "solid_fuel",
            "no_cook",
            "mixed",
            "other"
          ]
        },
        "backup_path_status": {
          "enum": [
            "unknown",
            "none",
            "present_unverified",
            "tested_pass",
            "tested_fail",
            "not_required"
          ]
        },
        "outage_cooking_test": {
          "enum": [
            "not_run",
            "pass",
            "partial",
            "fail",
            "not_required"
          ]
        }
      }
    },
    "replenishment": {
      "type": "object",
      "additionalProperties": false,
      "required": [
        "supply_paths",
        "local_production_status",
        "production_daily_calorie_equivalent",
        "production_inputs_mapped"
      ],
      "properties": {
        "supply_paths": {
          "type": "array",
          "items": {
            "type": "object",
            "additionalProperties": false,
            "required": [
              "path_id",
              "independence_group_id",
              "status",
              "critical"
            ],
            "properties": {
              "path_id": {
                "type": "string",
                "pattern": "^foodpath-[A-Za-z0-9._-]+$"
              },
              "independence_group_id": {
                "type": [
                  "string",
                  "null"
                ],
                "minLength": 1
              },
              "status": {
                "enum": [
                  "unknown",
                  "identified_unverified",
                  "verified_available",
                  "unavailable"
                ]
              },
              "critical": {
                "type": "boolean"
              }
            }
          }
        },
        "local_production_status": {
          "enum": [
            "unknown",
            "none",
            "possible_unverified",
            "measured_output",
            "field_tested"
          ]
        },
        "production_daily_calorie_equivalent": {
          "type": [
            "number",
            "null"
          ],
          "minimum": 0
        },
        "production_inputs_mapped": {
          "type": [
            "boolean",
            "null"
          ]
        }
      }
    },
    "dependencies": {
      "type": "array",
      "items": {
        "type": "object",
        "additionalProperties": false,
        "required": [
          "dependency_id",
          "kind",
          "critical",
          "backup_status"
        ],
        "properties": {
          "dependency_id": {
            "type": "string",
            "minLength": 1
          },
          "kind": {
            "enum": [
              "water",
              "power",
              "cooking_fuel",
              "cold_chain",
              "logistics",
              "supplier",
              "land",
              "labor",
              "seed_input",
              "storage",
              "other"
            ]
          },
          "critical": {
            "type": "boolean"
          },
          "backup_status": {
            "enum": [
              "none",
              "partial",
              "ready",
              "unknown",
              "not_required"
            ]
          }
        }
      }
    },
    "single_points_of_failure": {
      "type": "array",
      "uniqueItems": true,
      "items": {
        "type": "string",
        "minLength": 1
      }
    },
    "maintenance_status": {
      "enum": [
        "current",
        "due",
        "overdue",
        "unknown"
      ]
    },
    "independent_review_completed": {
      "type": "boolean"
    },
    "evidence_refs": {
      "type": "array",
      "uniqueItems": true,
      "items": {
        "type": "string",
        "minLength": 1
      }
    },
    "updated_at": {
      "type": "string",
      "format": "date-time"
    },
    "data_sensitivity": {
      "enum": [
        "public",
        "internal",
        "confidential",
        "restricted"
      ]
    }
  }
}
